{
  "presetId": "ontario-gr8-science",
  "title": "Ontario Grade 8 Science & Technology",
  "panel": "elementary",
  "region": "Ontario",
  "grade": "Grade 8",
  "subjectCode": "SCI",
  "strands": [
    {
      "name": "Strand A: STEM Skills & Connections",
      "overalls": [
        {
          "code": "A1",
          "description": "STEM Skills & Research Processes",
          "specifics": [
            { "code": "A1.1", "description": "Apply scientific research processes and engineering design skills to solve problems." },
            { "code": "A1.2", "description": "Investigate real-world applications of scientific innovations and technological careers." }
          ]
        }
      ]
    },
    {
      "name": "Strand B: Cells & Living Systems",
      "overalls": [
        {
          "code": "B1",
          "description": "Cell Biology & Medical Technologies",
          "specifics": [
            { "code": "B1.1", "description": "Assess social and environmental impacts of cell biology research and medical technologies." }
          ]
        },
        {
          "code": "B2",
          "description": "Cell Structure, Function & Organ Systems",
          "specifics": [
            { "code": "B2.1", "description": "Demonstrate understanding of cell structures, cellular processes, and organ system interactions." }
          ]
        }
      ]
    },
    {
      "name": "Strand C: Systems in Action (Mechanical)",
      "overalls": [
        {
          "code": "C1",
          "description": "Mechanical Efficiency & Automation",
          "specifics": [
            { "code": "C1.1", "description": "Assess personal, social, and environmental impacts of mechanical systems and automation." }
          ]
        },
        {
          "code": "C2",
          "description": "Simple Machines & Work Efficiency",
          "specifics": [
            { "code": "C2.1", "description": "Investigate mechanical advantage, work, forces, and efficiency in simple and complex systems." }
          ]
        }
      ]
    },
    {
      "name": "Strand D: Fluids (Liquids & Gases)",
      "overalls": [
        {
          "code": "D1",
          "description": "Fluid Mechanics & Technological Systems",
          "specifics": [
            { "code": "D1.1", "description": "Assess environmental and economic impacts of fluid mechanics technologies (hydraulic/pneumatic)." }
          ]
        },
        {
          "code": "D2",
          "description": "Viscosity, Density, Pressure & Buoyancy",
          "specifics": [
            { "code": "D2.1", "description": "Investigate properties of fluids including viscosity, mass-volume density, pressure, and buoyancy." }
          ]
        }
      ]
    },
    {
      "name": "Strand E: Water Systems",
      "overalls": [
        {
          "code": "E1",
          "description": "Water Sustainability & Watershed Management",
          "specifics": [
            { "code": "E1.1", "description": "Assess impacts of climate change and human activity on local and global water systems." }
          ]
        },
        {
          "code": "E2",
          "description": "Earth Water Distribution & Hydrologic Cycle",
          "specifics": [
            { "code": "E2.1", "description": "Demonstrate understanding of Earth's water systems, water tables, glaciers, and fluid cycles." }
          ]
        }
      ]
    }
  ]
}
